title,company,location,date,summary,url
Junior Administrative Assistant,Tetra Tech,"Edmonton, AB",10 days ago,"Data entry and word processing, including proofing of work. From our roots (as EBA Engineering Consultants), and now Tetra Tech Canada, we have progressively…",https://www.indeed.ca//rc/clk?jk=9f8f26eb473686d5&fccid=997110e6d9c4c093&vjs=3
#28-1907-SO- SP Junior Environmental Scientist,Millennium EMS Solutions,"Sherwood Park, AB",12 days ago,Data management and data entry using MS access databases. Senior Environmental Scientist. Currently we employ over 140 employees in various disciplines…,https://www.indeed.ca//rc/clk?jk=e75a78f1266f79f5&fccid=930950bd60de2141&vjs=3
"Scientist, Human Genomics",Destiny Bioscience Global Corp.,"Nisku, AB",6 days ago,Experience in high-dimensional data management and analysis skills. Destiny Bioscience is looking for a scientist to work with a multidisciplinary team…,https://www.indeed.ca//company/Destiny-Bioscience-Global-Corp./jobs/Scientist-c50426af10fe15d3?fccid=a7e0e8dc1e65fc95&vjs=3
Physical Scientist Inventory,Environment and Climate Change Canada,"Edmonton, AB",30+ days ago,Physical Scientist Research. Knowledge of approaches to quality control and quality assurance related to data collection or data management.,https://www.indeed.ca//rc/clk?jk=2a48ef8cfb902a4a&fccid=d45e6800befca5fb&vjs=3
Director of Data Science,AltaML Inc./Janalta Interactive Inc.,"Edmonton, AB",30+ days ago,Set the direction for building a high performing culture of data scientists and ML engineers. Humble – Listen to the data.,https://www.indeed.ca//rc/clk?jk=40db3cd9efa844c7&fccid=ec29960f5738501b&vjs=3
Jr. Geotechnical Engineer,Tetra Tech,"Edmonton, AB",4 days ago,"Analyzing field data and preparing detailed engineering reports and recommendations. From our roots (as EBA Engineering Consultants), and now Tetra Tech Canada,…",https://www.indeed.ca//rc/clk?jk=a8da71e3ca044b2f&fccid=997110e6d9c4c093&vjs=3
Water Quality Scientist,Golder Associates,"Edmonton, AB",30+ days ago,Water Quality Scientist. Performing and directing data analysis. Experience with leading and completing water quality field data collection programs.,https://www.indeed.ca//rc/clk?jk=ad47d858ac7b04b3&fccid=e3b502a5b609fca4&vjs=3
"Scientist, Veterinary Genomics",Destiny Bioscience Global Corp.,"Nisku, AB",6 days ago,Scientist – Veterinary Genomics*. Data management and annotation experience are strongly recommended. Experience in high-dimensional data management and…,https://www.indeed.ca//company/Destiny-Bioscience-Global-Corp./jobs/Scientist-a8d341a8a79df81e?fccid=a7e0e8dc1e65fc95&vjs=3
JUNIOR PROJECT TECHNICIAN/SCIENTIST,WSP,"Edmonton, AB",30+ days ago,"Environmental Scientist or Technician - Edmonton. Teaming with project technicians, scientists, contractors and other field personnel to complete on-site…",https://www.indeed.ca//rc/clk?jk=b31ee3aa2931ed64&fccid=125e77713a321cdc&vjs=3
Scientist – Endocannabinoid System,Destiny Bioscience Global Corp.,"Nisku, AB",6 days ago,"Experience in high-dimensional data management and analysis skills. This is an excellent opportunity for a highly-motivated, creative scientist to be a vital…",https://www.indeed.ca//company/Destiny-Bioscience-Global-Corp./jobs/Scientist-Endocannabinoid-System-498a2f6c5198a789?fccid=a7e0e8dc1e65fc95&vjs=3
Data Science Team Lead,AltaML Inc./Janalta Interactive Inc.,"Edmonton, AB",30+ days ago,You will be primarily responsible to lead a team of Data Scientists and manage ML/AI projects and research. Humble – Listen to the data.,https://www.indeed.ca//rc/clk?jk=c6384875c0ff86d6&fccid=ec29960f5738501b&vjs=3
"Scientist, Wildfire Operations",FPInnovations,"Edmonton, AB",30+ days ago,Collaborate with and support fellow scientists in the collection and analysis of field data. Scientists are required to work independently and in a…,https://www.indeed.ca//company/FPInnovations/jobs/Scientist-67a46340aee46622?fccid=b32a24eba437ab22&vjs=3
Staff Machine Learning Developer,AltaML Inc./Janalta Interactive Inc.,"Edmonton, AB",30+ days ago,Humble – Listen to the data. Provide mentorship to our Data Science team. Actively participates in building a high performing culture of data scientists and ML…,https://www.indeed.ca//rc/clk?jk=0fbd65f6c44748e2&fccid=ec29960f5738501b&vjs=3
Geomatics Engineer,Northwest Hydraulic Consultants,"Edmonton, AB",3 days ago,"Responsibilities will also include office-based work, such as survey data processing and reporting, coordination of field resources and personnel, data…",https://www.indeed.ca//rc/clk?jk=e188c233ddf0d05d&fccid=cb65975c892e755a&vjs=3
Quality Assurance Officer - Permanent - Environmental and Petroleum,AGAT Laboratories,"Edmonton, AB",5 days ago,"Evaluate data quality and maintain records, control charts and other pertinent performance information. Our scientists are highly-skilled and specialized in the…",https://www.indeed.ca//company/AGAT-Laboratories/jobs/Quality-Assurance-Officer-a2bf002848037eb7?fccid=2db7fc8995a3b664&vjs=3
"Manager, Cannabis Tissue Culture",Destiny Bioscience Global Corp.,"Nisku, AB",6 days ago,"Maintains SOPs, lab data and records, lab notebooks and computer databases. Work closely with Scientists and Breeders to make best use of available varieties…",https://www.indeed.ca//company/Destiny-Bioscience-Global-Corp./jobs/Manager-bd22f89b1ea19ae9?fccid=a7e0e8dc1e65fc95&vjs=3
"Laboratory Analyst (Ecotoxicology) - Edmonton, AB (Full-Time)",CARO Analytical Services,"Edmonton, AB",30+ days ago,"Uses LIMS and CETIS software to enter generated test data. Is a Western Canada based environmental and food analytical laboratory full of smart, engaged…",https://www.indeed.ca//company/CARO-Analytical-Services/jobs/Laboratory-Analyst-50ef914b0980735b?fccid=29b52b6ba68d5111&vjs=3
Senior Business Data Analyst,Intuit,"Edmonton, AB",30+ days ago,"Solve marketing and product analytics problems by doing work such as developing data structures, pipelines, and data visualizations that enable us to find…",https://www.indeed.ca//rc/clk?jk=403e98143847ed33&fccid=9784ae78e9834539&vjs=3
Sr. Scientist - Process Development,Radient Technologies Inc.,"Edmonton, AB",17 days ago,"With several growth initiatives underway, Radient is looking for a unique individual to fill the role of Scientist (Process Development). About Radient*.",https://www.indeed.ca//company/Radient-Technologies-Inc./jobs/Senior-Scientist-9e6b9db4330ccafa?fccid=ffb074bb7a14f34d&vjs=3
Environmental Monitor/Inspector,Millennium EMS Solutions,"Sherwood Park, AB",6 days ago,"Data management and data entry using MS access databases. Currently we employ over 140 employees in various disciplines including, hydrogeologists, engineers,…",https://www.indeed.ca//rc/clk?jk=4a3746a7c8accaf2&fccid=930950bd60de2141&vjs=3
Customer Solutions Representative,Bureau Veritas Laboratories,"Edmonton, AB",30+ days ago,Communicate outcome of data investigations and re-analysis to clients as required; Join our talented community of scientists and experts and apply today at http…,https://www.indeed.ca//rc/clk?jk=80834965e87295c2&fccid=fdd8787d3dc18c3e&vjs=3
R&D Project Manager,Destiny Bioscience Global Corp.,"Nisku, AB",30+ days ago,"Skilled in data interpretation and report writing for studies. Assist with and contribute to project policies and procedures, data management, file compilations…",https://www.indeed.ca//company/Destiny-Bioscience-Global-Corp./jobs/R&D-Project-Manager-0771f337648cb028?fccid=a7e0e8dc1e65fc95&vjs=3
Environmental Site Assessor,S2S Environmental,"Edmonton, AB",4 days ago,"We require Project Assessors/Project Scientists in the Edmonton, Calgary and Vancouver areas. Collect, manage, analyze and interpret historical documents and…",https://www.indeed.ca//company/S2S-Environmental/jobs/Environmental-Site-Assessor-87cc67c75528994c?fccid=25cfadee2a51f10d&vjs=3
Environmental Field Technician,Golder Associates,"Edmonton, AB",30+ days ago,Or office assignments under the direction of more experience scientists and technical employees. Filing and managing all project related field notes including…,https://www.indeed.ca//rc/clk?jk=603800885555078d&fccid=e3b502a5b609fca4&vjs=3
Software Developer 2 -Natural Language Understanding,Intuit,"Edmonton, AB",30+ days ago,"Working knowledge of data querying and data processing tools (e SQL, Python, NumPy). As part of the team, you will work with product managers, data scientists,…",https://www.indeed.ca//rc/clk?jk=fefd2350cc5cde6f&fccid=9784ae78e9834539&vjs=3
Hydrogeologist,Matrix Solutions Inc.,"Edmonton, AB",17 days ago,"Oversee and facilitate objective-driven data collection. Manage complex projects while directing multi-disciplinary teams including engineers, hydrogeologists,…",https://www.indeed.ca//rc/clk?jk=49026200bbc21a43&fccid=16b7b760774a1009&vjs=3
Laboratory Team Lead,CARO Analytical Services,"Edmonton, AB",30+ days ago,"Reviews analytical data, and generates test reports (where required). We are smart, engaged scientists, driven to make the world safer and healthier.",https://www.indeed.ca//company/CARO-Analytical-Services/jobs/Laboratory-Team-Lead-32fb2d42b05e05cb?fccid=29b52b6ba68d5111&vjs=3
Technical Solutions Representative,Bureau Veritas Laboratories,"Edmonton, AB",30+ days ago,Communicate outcome of data investigations and re-analysis to clients as required; Join our talented community of scientists and experts and apply today at http…,https://www.indeed.ca//rc/clk?jk=01d4b7630da9bf9f&fccid=fdd8787d3dc18c3e&vjs=3
Reclamation Specialist,Millennium EMS Solutions,"Sherwood Park, AB",30+ days ago,"File compilation, organization of field data, and interpretation of laboratory results. Currently we employ over 140 employees in various disciplines including,…",https://www.indeed.ca//rc/clk?jk=774fabe51218c85a&fccid=930950bd60de2141&vjs=3
Senior Analyst,Bureau Veritas Laboratories,"Edmonton, AB",30+ days ago,"Reviews and interprets data, highlights errors and/or requests reworks. Join our talented community of scientists and experts and apply today at http://bvlabs…",https://www.indeed.ca//rc/clk?jk=a291c0af933ab2b8&fccid=fdd8787d3dc18c3e&vjs=3
"Territory Sales Manager - Edmonton, Alberta, Canada",JUUL Labs,"Edmonton, AB",30+ days ago,Able to make data driven decisions. Proficiency with and willingness to learn new sales technology and data analytics.,https://www.indeed.ca//rc/clk?jk=b61bc749c7d6a273&fccid=6e0a19936820440f&vjs=3
Backend Python/Django Developer,selfdecode.com,"Edmonton, AB",30+ days ago,Able to integrate multiple data sources and databases into one system. About Us: We are a fast-growing and leading company in the personalized health space.,https://www.indeed.ca//rc/clk?jk=5355bc8a75405cf7&fccid=41765cf8195baf38&vjs=3
Product Development Manager,Atlas Growers,"Spruce Grove, AB",30+ days ago,"Manage Product Development Scientists. Identification of data collection strategy. The goal of this research is to provide clinical, reliable data to Canadians…",https://www.indeed.ca//rc/clk?jk=00762c8790a1619b&fccid=3f6c4ab2ff727a80&vjs=3
"Senior Manager, Omnia AI - Edmonton",Deloitte,"Edmonton, AB",30+ days ago,"Take a leading role in delivering advisory services to high growth organizations with a diverse team consisting of data scientists, data architects, software…",https://www.indeed.ca//rc/clk?jk=1218ed9e5cb421e6&fccid=9e215d88a6b33622&vjs=3
Senior Contaminant Hydrogeologist,Millennium EMS Solutions,"Sherwood Park, AB",30+ days ago,"Currently we employ over 140 employees in various disciplines including, hydrogeologists, engineers, soil scientists, foresters, vegetation ecologists, auditors…",https://www.indeed.ca//rc/clk?jk=0ce6df556cec1ecc&fccid=930950bd60de2141&vjs=3
Senior Product Designer - Interaction,Intuit,"Edmonton, AB",30+ days ago,"Effectively collaborate with and influence your project partners and the product organization made up of other designers, content strategists, product managers,…",https://www.indeed.ca//rc/clk?jk=3345681d2be81e6b&fccid=9784ae78e9834539&vjs=3
Assistant or Associate Professor,University of Alberta,"Edmonton, AB",30+ days ago,"Preference will be given to clinician scientists who are working in addictions and/or child & adolescent psychiatry, and appointments are targeted at the level…",https://www.indeed.ca//rc/clk?jk=262cbe46bff690c1&fccid=09ac3ce4d9d271d1&vjs=3
Assistant/Associate/Professor Clinician Scientist and Endowed Chair in Clinical and/or Outcomes Research,University of Alberta,"Edmonton, AB",30+ days ago,"Data Coordinating Centre – WCHRI’s data coordinating centre (DCC) assists researchers in obtaining high-quality, statistically appropriate, verifiable data in…",https://www.indeed.ca//rc/clk?jk=3a3e2fc7786e2c2a&fccid=09ac3ce4d9d271d1&vjs=3
CASA Research Chair in Child & Adolescent Psychiatry,University of Alberta,"Edmonton, AB",24 days ago,Preference will be given to clinician scientists who are currently working in Child & Adolescent psychiatry. The Research Chair is a full-time contingent tenure…,https://www.indeed.ca//rc/clk?jk=66d7712d50592218&fccid=09ac3ce4d9d271d1&vjs=3
